patentno,patpubdate,title,appno,priorpub,priorpubdate,abstract,invs,assignee,xref,filedate,govint,parentcase,childcase,date371,pctpubno
07521232,20090421,Emissive species for clinical imaging,11444142,20070281289,20071206,"The present invention relates to materials and methods useful in the study of cells and species associated with cells. Materials of the present invention may include emissive, photostable organic molecules (e.g., conjugated polymers, conjugated oligomers) that are appropriately functionalized to interact with a cell with essentially no disruption in normal cell functioning. The present invention may be useful in, for example, cell imaging, cell tracking, in vivo monitoring of cellular events, drug delivery, and determination of biological species. In one embodiment, a conjugated polymer or oligomer may be internalized into a cell and may exhibit a strong and stable emissive signal, allowing the cell to be monitored under extensive microscopic conditions for extended periods of time.",[Joongho Moon],"[ICx Nomadics, Inc.]","",20060531,"This invention was made with the support under the following government contract: DMI-0239285, awarded by the National Science Foundation. The government has certain rights in the invention.","","","",""
07521233,20090421,Methods and devices for promoting endothelial morphogenesis,11675810,20070154517,20070705,"In one aspect the present invention provides methods for promoting endothelial morphogenesis. The methods of this aspect of the invention include the step of providing to one or more endothelial cells an amount of an osteoprotegerin sufficient to promote endothelial morphogenesis. The methods of this aspect of the invention can be practiced in vivo or in vitro. In another aspect, the present invention provides implantable medical devices that each include: (a) a device body; and (b) a layer attached to a surface of the device body, the layer comprising a molecule selected from the group consisting of osteoprotegerin and a nucleic acid molecule encoding osteoprotegerin, wherein the device is adapted to be completely or partially implanted into an animal body. The implanted medical device thus promotes the growth of blood vessels in the surrounding tissue, thereby reducing or preventing the formation of a collagenous capsule around the implanted medical device.",[Uriel M. Malyankar][Marta Scatena][Cecilia M. Giachelli],"[Washington, University of]","This application is a divisional of application Ser. No. 10/142,658, filed May 9, 2002, which claims the benefit of Application No. 60/290,230, filed on May 10, 2001.",20070216,"This invention was made with government support under grant number EEC-9529161 awarded by National Science Foundation; and grant number HL18645, awarded by National Institutes of Health. The government has certain rights in the invention.",10142658,11675810,"",""
07521394,20090421,Nanoparticles containing titanium oxide,11615702,20070202334,20070830,"A titanium oxide nanoparticle includes anatase titanium oxide, and may be a nanofiber having a minimum dimension less than 200 nanometers and having an aspect ratio greater than 20:1. A titanium oxide nanoparticle including anatase titanium oxide may include a dopant metal and/or a dopant nonmetal, and may be in a form other than a nanosphere. A method of making nanoparticles includes heating a reaction mixture in an autoclave, where the reaction mixture includes a titanium source and a polar organic solvent.",[Rong-Cai Xie][Jian-Ku Shang][Pinggui Wu],[The Board of Trustees of the University of Illinois],"This application claims the benefit of U.S. Provisional Application No. 60/754,680 entitled &#x201C;Nanoparticles Containing Titanium Oxide&#x201D; filed Dec. 29, 2005, which is incorporated by reference in its entirety.",20061222,"The subject matter of this application may have been funded in part under a research grant from the National Science Foundation, under Grant Number CTS-0120978, Banner/UFAS 149646919110. The U.S. Government may have rights in this invention.","","","",""
07521499,20090421,Flame retardant and UV Absorptive polymethylmethacrylate nanocomposites,10490882,20050261413,20051124,"A composition which includes polymethylmethacrylate and an organoclay functionalized with intercalation agent, wherein said intercalation agent is a reaction product of a polyamine and an alkyl halide in a polar solvent, preferably a dimethyl, ditallow ammonium functionalized monmorillonite clay as shown in (FIG. ).",[Miriam Rafailovich][Mayu Si][Michael Goldman][Jonathan Sokolov][Benjamin Chu][Shaoming Zhu],[Research Foundation of State University of New York],"This application claims priority based on U.S. provisional application No. 60/325,942 filed on Sep. 28, 2001.",20020927,This invention was made with Government support under Grant No. DMR0080604 awarded by the National Science Foundation. The Government has certain rights in the invention.,"","",20040326,PCT/US02/30971
07521769,20090421,Photonic crystal biosensor structure and fabrication method,11177707,20070009380,20070111,The invention provides sensor compositions and method of making sensors.,[Brian T. Cunningham],"[SRU Biosystems, Inc.]","",20050708,This invention was made with Government support under Grant Number BES04-27657 awarded by the National Science Foundation. The Government has certain rights in the invention.,"","","",""
07521825,20090421,Interface switch for distributed energy resources,11266976,20070129110,20070607,"A method and apparatus for an interface switch having an external terminal electrically connected to an AC voltage Ē at a frequency ω(for example a utility supply), and an internal terminal electrically connected to an AC voltage  at a selectable frequency ω (for example a microsource). In one embodiment, the interface switch is closed when the voltage difference between Ē and  and the relative phase angle δbetween Ē and  are both small, and when the higher frequency voltage (as between Ē and ) leads the lower frequency voltage. In another embodiment, the interface switch is closed when the envelope of the voltage difference between Ē and  reaches a local minimum at a point of inflection.",[Robert H. Lasseter][Paolo Piagi],[Wisconsin Alumni Research Foundation],"",20051104,This invention was made with United States government support awarded by the following agencies:  ,"","","",""
07521921,20090421,Displacement sensor,11259665,20060087314,20060427,"Sensors and methods for measuring displacement are disclosed. In one embodiment, among others, a resistive element is configured to receive an alternating voltage between a first electrical terminal and a second electrical terminal, the first and second electrical terminals defining a length of the resistive element. A signal pickup is capacitively coupled to the resistive element and is configured to be moved along the length of the resistive element at a substantially fixed distance from the resistive element and without contact between the resistive element and the signal pickup. A shielded cable, such as a coaxial cable, electrically connected to the signal pickup carries a signal having an amplitude proportional to the position of the signal pickup with respect to the first and second electrical terminals.",[Haihong Zhu][Wayne J. Book],[Georgia Tech Research Corporation],"This application claims priority to and benefit of U.S. Provisional Patent Application entitled &#x201C;Displacement Sensor Embedded Cylinder and Novel Displacement Sensor,&#x201D; assigned Ser. No. 60/622,285, and filed on Oct. 26, 2004, which is incorporated by reference in its entirety.",20051026,"The U.S. Government may have a paid-up license in this invention and the right in limited circumstances to require the patent owner to license to others on reasonable terms as provided for by the terms of Contract No. NS-0121663, awarded by the National Science Foundation.","","","",""
07522152,20090421,Products and processes for providing haptic feedback in resistive interface devices,10855902,20050275967,20051215,"Products and processes for providing haptic feedback in a user interface are disclosed. One exemplary embodiment of an apparatus comprises a first element comprising a first surface, a second element comprising a second surface, and an actuator configured vary a force between the first and second surfaces. In one embodiment, the second element may be configured to be displaced relative to first element in a degree of freedom. In another embodiment, at least one of the first surface and the second surface may comprise a thermoplastic polymer.",[Neil T. Olien][Pedro Gregorio],[Immersion Corporation],"",20040527,This invention was made in part with support from the federal government under Grant Number NSF DMII-0091589 awarded by the National Science Foundation. The federal government may have certain rights in this invention.,"","","",""
07522417,20090421,Multi-mode fluid cooling system and method,11396206,20070230126,20071004,A cooling system and method that significantly improves spray evaporative cooling by using a mixture of cooling fluids having different boiling points. The cooling fluid mixture is sprayed onto a surface to be cooled. Efficient cooling with reduced cooling fluid volume is provided by both evaporation of the more volatile component of the mixture as well as heating of the less volatile component which remains in contact with the surface being cooled. More uniform temperatures across the surface being cooled and a reduced risk of potentially damaging critical heat flux is achieved.,[Adam G. Pautsch][Timothy A. Shedd],[Wisconsin Alumni Research Foundation],"",20060330,This invention was made with United States government support awarded by the following agencies: NSF 0134510. The United States has certain rights in this invention.,"","","",""
07522434,20090421,Temperature estimation based on a signal oscillation,11260885,20070097718,20070503,"A method of estimating a temperature at a component of a device is provided. The temperature may be used to provide thermal load management of the device. In an exemplary embodiment, a switched mode power converter includes a power converter module and a switch that controls a switching cycle of the power converter module. A signal includes a bus voltage component and an oscillating signal component at least partially caused by switching of the switch. A switch instant of the switch can be isolated. A characteristic of the oscillating signal component of the signal can be detected. For example, a first peak voltage of the oscillating signal component can be detected after the switch instant. The temperature of the power converter module is estimated using the detected characteristic of the oscillating signal component. For example, the temperature can be estimated using the first peak voltage and best-fit curve parameters in solving a linear or a quadratic equation.",[Anusheel Nahar][Robert Donald Lorenz],[Wisconsin Alumni Research Foundation],"",20051027,This invention was made with United States government support awarded by the following agency: NSF 9731677. The United States government has certain rights in this invention.,"","","",""
07522673,20090421,Space-time coding using estimated channel information,10420351,20040066761,20040408,"The invention is directed to techniques for space-time coding in a wireless communication system in which the transmitter makes use of multiple transmit antennas. The transmitter uses channel information estimated by a receiving device and returned to the transmitter, e.g., as feedback. In one exemplary embodiment, the transmitter receives a mean feedback information that defines a mean channel value associated with the different channels of the different antennas. In another exemplary embodiment, the transmitter receives covariance feedback, e.g., statistical values associated with each of the different channels.",[Georgios B. Giannakis][Shengli Zhou],[Regents of the University of Minnesota],"This application claims priority from U.S. Provisional Application Ser. No. 60/374,886, filed Apr. 22, 2002, U.S. Provisional Application Ser. No. 60/374,935, filed Apr. 22, 2002, U.S. Provisional Application Ser. No. 60/374,934, filed Apr. 22, 2002, U.S. Provisional Application Ser. No. 60/374,981, filed Apr. 22, 2002, U.S. Provisional Application Ser. No. 60/374,933, filed Apr. 22, 2002, the entire contents of which are incorporated herein by reference.",20030421,"This invention was made with Government support under Contract Nos. ECS-9979443 and CCR-0105612, awarded by the National Science Foundation, and Contract No. DAAD19 01-2-0011 (University of Delaware Subcontract No. 497420) awarded by the U.S. Army. The Government may have certain rights in this invention.","","","",""
07523218,20090421,O(log n) dynamic router tables for prefixes and ranges,10426423,"","","An improved system and method is provided for packet routing in dynamic router tables. Specifically, the invention provides a method, computer system, and computer readable media for using Priority Search Trees (PSTs) to match, insert, and delete rules in dynamic routing tables in O(log n) time. In a first embodiment, for a dynamic router table consisting of n pairs of tuples, each tuple comprising an address prefix and next-hop information, the invention provides a system and method, using a PST, for inserting a new tuple, deleting an existing tuple, and searching for the tuple with the longest matching prefix for destination address, wherein each operation is performed in O(log n) time. In a second embodiment, for a dynamic router table consisting of n pairs of tuples, each tuple comprising a range of destination addresses and next-hop information, the invention provides a system and method, using a PST and a set of red-black priority search tree (RBPST), for inserting a new tuple, deleting an existing tuple, and searching for the tuple with the most specific matching range, wherein each operation is performed in O(log n) time. The invention can be implemented in numerous ways to improve dynamic router table performance, including as a system, a device, a method, or a computer readable medium.",[Sartaj Kumar Sahni][Haibin Lu],"[University of Florida Research Foundation, Inc.]","This application claims the benefit of U.S. Provisional application No. 60/376,853, filed Apr. 30, 2002.",20030430,"This invention was made in part with funding under a funding grant, No. CCR9912395, from the National Science Foundation. The government has certain rights in the invention.","","","",""
07523650,20090428,Multifunctional probe array system,11779637,20070289369,20071220,"A probe array for includes a handle, a first probe and a second probe. The first probe has a first shank, connected to the handle, and a first tip; and the second probe has a second shank, connected to the handle, and second tip. The first tip contains a different material from the second tip. The probe array may be used to write on a surface by contacting the first tip with a surface, where a first ink is on the first tip. This writing method may further include lifting the first tip from the surface and contacting the second tip with the surface.",[Xuefeng Wang][Chang Liu],[The Board of Trustees of the University of Illinois],"This application is a divisional application of U.S. application Ser. No. 11/234,401, filed Sep. 23, 2005 now U.S. Pat. No. 7,281,419, incorporated herein by reference, which claims the benefit of U.S. Provisional Application Ser. No. 60/719,158, entitled &#x201C;Multifunctional Probe Array System&#x201D;, filed Sep. 21, 2005.",20070718,"The subject matter of this application may have been funded in part under a research grant from the National Science Foundation, under NSF Grant Number EEC-0118025. The U.S. Government may have rights in this invention.",11234401,11779637,"",""
07524152,20090428,Three-axis micro- and meso-scale machining apparatus,11004045,20060120819,20060608,"A three-axis micro- or meso-scale machining apparatus. Embodiments of the apparatus include a spindle having a tool for machining a workpiece, a z-axis movement platform for supporting the spindle and translating the spindle along a z-axis, a mount for supporting the workpiece, and a suspended x-y axes movement platform for supporting the mount and translating the mount along both x- and y-axes.",[Andrew Honegger][Richard E. DeVor][Shiv G. Kapoor],[The Board of Trustees if the University of Illinois],"",20041203,This invention was made with Government assistance under National Science Foundation Grant No. NSF DMI 98-16302. The Government has certain rights in this invention.,"","","",""
07524408,20090428,Surface nanopatterning,11029303,20060068090,20060330,"A method for producing, and a product having, a surface nanopattern, wherein the method comprises the steps of: obtaining a substrate with a smooth surface; acquiring a self-assembling monolayer precursor, wherein the precursor includes an inducible, usually photocatalytically, active region and a substrate attachment region; mixing a plurality of the self-assembling monolayer precursors with the substrate to produce a self-assembled monolayer having an exposed surface comprising the inducible active regions and anchored to the substrate smooth surface by the substrate attachment regions; obtaining a path-directable nanoparticle; contacting the path-directable nanoparticle with the exposed surface at an interface area; exposing the exposed surface contacted with the path-directable nanoparticle to an inducing event, usually exposure to light, thereby chemically altering the inducible active regions and producing a detectable state in the interface area on the exposed surface; and applying a force of variable magnitude and direction in the plane of the surface to the contacted path-directable nanoparticle to produce movement of the contacted nanoparticle over the exposed surface thereby extending the detectable state interface area into a detectable trace over the exposed surface to produce the nanopatterened surface.",[Harold G. Monbouquette][Miguel Garcia-Garibay],[The Regents of the University of California],"This application claims priority from, and is a 35 U.S.C. &#xA7; 111(a) continuation of, co-pending PCT international application serial number PCT/US03/21496 filed on Jul. 8, 2003 designating the U.S., incorporated herein by reference in its entirety, which in turn claims priority from U.S. provisional application Ser. No. 60/394,701 filed on Jul. 8, 2002, incorporated herein by reference in its entirety. Priority is claimed to both of the above-identified patent applications.",20050105,"This invention was made with Government support under Grant No. CTS-9816494, awarded by the National Science Foundation and Grant No. N00014-1-0919, awarded by the Office of Naval Research. The Government has certain rights in this invention.",PCT/US03/21496,11029303,"",""
07524459,20090428,Optoelectronic and microfluidic integration for miniaturized spectroscopic devices,10351294,20030235924,20031225,Techniques for integrating optoelectronic system and microfluidic system. An apparatus for optical analysis includes a detector system and a microfluidic system on the detector system. The apparatus is free from any lens system between the microfluidic system and the detector system. Methods of making such an apparatus and using such an apparatus are also disclosed.,[Mark L. Adams][Stephen R. Quake][Axel Scherer],[California Institute of Technology in Pasadena],"This application claims priority to U.S. Provisional No. 60/351,485 filed Jan. 24, 2002, which is incorporated by reference herein.",20030123,"Work described herein has been supported, in part, by NSF grant BES-0119493 and DARPA grant DAAD19-00-1-0392. The United States Government may therefore have certain rights in the invention.","","","",""
07524630,20090428,Functionalized nanoparticles and methods of use,10421491,20040067503,20040408,"Silica-coated nanoparticles functionalized with biologically active molecules such as antibodies and nucleotides are used to label cells, to detect and isolate nucleic acid molecules having specific nucleotide sequences, and to separate a mixture of different nucleic acid molecules.",[Weihong Tan][Jin Shouguang][Xiaojun Zhao][Rovelyn Tapec Dytioco][Timothy James Drake][Lisa Renee Hilliard],"[University of Florida Research Foundation, Inc.]","The present application claims the benefit of U.S. provisional patent application Nos. 60/375,122 and 60/374,405, both of which were filed on Apr. 22, 2002.",20030422,"This invention was made with U.S. government support under grant number N00014-98-1-0621 awarded by the Office of Naval Research; grant numbers DBI-9871880, CTS-0087676, and CHE-9733650 all awarded by the National Science Foundation; and grant numbers CA92581 and NS39891 both awarded by the National Institutes of Health. The U.S. government may have certain rights in the invention.","","","",""
07524664,20090428,Regio- and enantioselective alkane hydroxylation with modified cytochrome P450,10869825,20050059128,20050317,"Cytochrome P450 BM-3 from was engineered using a combination of directed evolution and site-directed mutagenesis to hydroxylate linear alkanes regio- and enantioselectively using atmospheric dioxygen as an oxidant. Mutant 9-10A-A328V hydroxylates octane primarily at the 2-positio to form S-2-octanol (40% ee). Another mutant, 1-12G, hydroxylates alkanes larger than hexane primarily at the 2-position, but forms R-2-alcohols (40-55% ee). These biocatalysts are highly active for alkane substrates and support thousands of product turnovers. These regio- and enantio-selectivities are retained in whole-cell biotransformations with , where the engineered P450s can be expressed at high levels and the expensive cofactor is supplied endogenously.",[Frances H. Arnold][Matthew W. Peters][Peter Meinhold],[California Institute of Technology],"This Application claims priority to U.S. Provisional Application No. 60/479,126 filed Jun. 17, 2003, herein incorporated by reference in its entirety.",20040615,This invention was made with government support under Grant Number BES 9981770 awarded by National Science Foundation. The government has certain rights in the invention.,"","","",""
07524678,20090428,Materials and methods for the alteration of enzyme and acetyl CoA levels in plants,11167856,20050268352,20051201,"The present invention provides nucleic acid and amino acid sequences of acetyl CoA synthetase (ACS), plastidic pyruvate dehydrogenase (pPDH), ATP citrate lyase (ACL), pyruvate decarboxylase (PDC), and aldehyde dehydrogenase (ALDH), specifically ALDH-2 and ALDH-4. The present invention also provides a recombinant vector comprising a nucleic acid sequence encoding one of the aforementioned enzymes, an antisense sequence thereto or a ribozyme therefor, a cell transformed with such a vector, antibodies to the enzymes, a plant cell, a plant tissue, a plant organ or a plant in which the level of an enzyme has been altered, and a method of producing such a plant cell, plant tissue, plant organ or plant. Desirably, alteration of the level of enzyme results in an alteration of the level of acetyl CoA in the plant cell, plant tissue, plant organ or plant. In addition, the present invention provides a recombinant vector comprising an antisense sequence of a nucleic acid sequence encoding pyruvate decarboxylase (PDC), the E1α subunit of pPDH, the E1β subunit of pPDH, the E2 subunit of pPDH, mitochondrial pyruvate dehydrogenase (mtPDH) or aldehyde dehydrogenase (ALDH) or a ribozyme that can cleave an RNA molecule encoding PDC, E1α pPDH, E1β pPDH, E2 pPDH, mtPDH or ALDH.",[Basil J. Nikolau][Eve S. Wurtele][David J. Oliver][Patrick S. Schnable][Tsui-Jung Wen],"[Iowa State University Research Foundation, Inc.]","This patent application is a divisional of copending U.S. patent application Ser. No. 10/293,865, filed Nov. 13, 2002, which is a divisional of U.S. patent application Ser. No. 09/344,882 (U.S. Pat. No. 6,764,851), filed Jun. 25, 1999, which claims the benefit of U.S. Provisional Patent Application No. 60/090,717, filed Jun. 26, 1998.",20050627,"This invention was made, in part, with funding from the National Science Foundation under Grant No. IBN-9696154 and from the Department of Energy to the Consortium for Plant Biotechnology Research via the Prime Agreement No. DE-FC05-92OR22072. Therefore, the United States of America may have certain rights in the invention.",10293865,11167856,"",""
07524966,20090428,Method for preparing ladderanes,10683472,20090088572,20090402,"Ditopic molecules in the form of linear reaction templates have been used to construct ladder-like hydrocarbons known as [n]-ladderanes (n=3,5). The templates assemble and position reactant molecules in the solid state by way of hydrogen bonds for [2+2] photodimerization. The products, which are based on recently identified naturally occurring frameworks, form stereospecifically, in gram quantities, and in quantitative yield. The control of reactivity achieved using linear templates provides a basis for the development of molecular tools, termed assemblers, that could be used to manufacture, with atomic-level precision, a wide range of products (e.g. molecular nanostructures) with unique properties.",[Leonard R. MacGillivray],[University of Iowa Research Foundation],"",20031008,"The invention described herein was made with government support under CAREER Award, DMR-0133138, L.R.M. awarded by the National Science Foundation. The United States Government has certain rights in the invention.","","","",""
