patentno,patpubdate,title,appno,priorpub,priorpubdate,abstract,invs,assignee,xref,filedate,govint,parentcase,childcase,date371,pctpubno
07595074,20090929,Polymeric antioxidants,10761933,20040214935,20041028,"A method of preparing a phenolic polymer comprising: a) protecting at least one hydroxyl group of a substituted or unsubstituted phenol represented by Structural Formula (XXIX), wherein: R, R, R, Rand Rare independently —H, —OH, —NH, —SH, a substituted or unsubstituted alkyl or aryl group, a substituted or unsubstituted alkoxycarbonyl or aryloxycarbonyl group, a substituted or unsubstituted alkoxy group or a saturated or unsaturated carboxylic acid group; or R, R, R, Ror R, in conjunction with an adjacent R, R, R, Ror R, forms a substituted or unsubstituted alkylene dioxy group; provided that at least one of R, R, R, Ror Ris a tert-butyl group -ethenyl--carboxylic acid or ester thereof, a substituted or unsubstituted alkylene dioxy group or a substituted or unsubstituted n-alkoxycarbonyl group, at least one of R, R, R, Ror Ris a hydroxyl group, and at least one of R, R, R, Rand Ris —H; with a protecting group, wherein thereby obtaining one or more protected hydroxyl groups; and b) polymerizing the substituted or unsubstituted phenol, thereby obtaining the phenolic polymer.",[Ashok L. Cholli][Vijayendra Kumar][Ashish Dhawan][Jayant Kumar][Virinder Singh Parmar][Lynne Ann Samuelson][Ferdinando F. Bruno],[University of Massachusetts Lowell][The United States of America as represented by the Secretary of the Army],"This application is a continuation-in-part of U.S. application Ser. No. 10/408,679, filed Apr. 4, 2003 now U.S. Pat. No. 7,223,432, which claims the benefit of U.S. Provisional Application No. 60/370,468, filed on Apr. 5, 2002. This application is also a continuation-in-part of International Application No. PCT/US03/10782, which designated the United States and was filed on Apr. 4, 2003, published in English, which claims the benefit of U.S. Provisional Application No. 60/370,468, filed on Apr. 5, 2002. The entire teachings of the above applications are incorporated herein by reference.",20040121,"The invention was supported, in whole or in part, by a grant DMR-9986644 from National Science Foundation. The Government has certain rights in the invention.",10408679,10761933,"",""
07595176,20090929,Methods and reagents for quantitative analysis of species,10558965,20070105106,20070510,The invention sets forth specific probes and primer pairs for such quantitative analysis and methods of obtaining template DNA from the species of interest. These techniques are useful in a bioremediation process to monitor and control the dechlorination of chlorinated hydrocarbons.,[Frank Loeffler][Kirsti M. Ritalahti],[Georgia Tech Research Corporation],"This is a U.S. National Phase application under 35 U.S.C. &#xA7;371 of International Patent Application No. PCT/US04/16978, filed May 27, 2004, which claims the benefit of U.S. Provisional Application No. 60/474,831 filed May 30, 2003, all of which are incorporated by reference herein.",20040527,"Research and development leading to certain aspects of the present invention were supported, in part, by research grants from the United States Army (DACA72-00-C-0023) and the National Science Foundation (IBN-0090496). The U.S. government may have certain rights in this invention.","","",20051130,PCT/US2004/016978
07595190,20090929,Transporters and their uses,10520497,20060168697,20060727,"The present invention is generally related to plant genetic engineering. In particular, the invention is directed to nucleic acids and methods for conferring salt tolerance on plants and other organisms.",[Huazhong Shi][Eduardo Blumwald],"","",20030709,"This invention was made with Government support under Grant No. IBN 0110622, awarded by the National Science Foundation. The government has certain rights in this invention.","","",20050914,PCT/US03/21549
07595260,20090929,"Doped elongated semiconductors, growing such semiconductors, devices including such semiconductors, and fabricating such devices",11543326,20070026645,20070201,"A bulk-doped semiconductor may be at least one of the following: a single crystal, an elongated and bulk-doped semiconductor that at any point along its longitudinal axis, has a largest cross-sectional dimension less than 500 nanometers, and a free-standing and bulk-doped semiconductor with at least one portion having a smallest width of less than 500 nanometers. At least one portion of such a semiconductor may have a smallest width of less than 200 nanometers, or less than 150 nanometers, or less than 100 nanometers, or less than 80 nanometers, or less than 70 nanometers, or less than 60 nanometers, or less than 40 nanometers, or less than 20 nanometers, or less than 10 nanometers, or even less than 5 nanometers. Such a semiconductor may be doped during growth. Such a semiconductor may be part of a device, which may include any of a variety of devices and combinations thereof.",[Charles M. Lieber][Yi Cui][Xiangfeng Duan][Yu Huang],[President and Fellows of Harvard College],"This application is a continuation of U.S. patent application Ser. No. 09/935,776, entitled &#x201C;Doped Elongated Semiconductors, Growing Such Semiconductors, Devices Including Such Semiconductors And Fabricating Such Devices, filed Aug. 22, 2001; which claims priority under 35 U.S.C. &#xA7;119(e) to commonly-owned, co-pending U.S. Provisional Patent Application Ser. No. 60/226,835, entitled, &#x201C;Semiconductor Nanowires&#x201D;, filed Aug. 22, 2000; Ser. No. 60/292,121, entitled, &#x201C;Semiconductor Nanowires&#x201D;, filed May 18, 2001; Ser. No. 60/254,745, entitled, &#x201C;Nanowire and Nanotube Nanosensors,&#x201D; filed Dec. 11, 2000; Ser. No. 60/292,035, entitled &#x201C;Nanowire and Nanotube Nanosensors,&#x201D; filed May 18, 2001; Ser. No. 60/292,045, entitled &#x201C;Nanowire Electronic Devices Including Memory and Switching Devices,&#x201D; filed May 18, 2001; and Ser. No. 60/291,896, entitled &#x201C;Nanowire Devices Including Emissive Elements and Sensors,&#x201D; filed May 18, 2001, each of which is hereby incorporated by reference in its entirety.",20061004,"This invention was made with government support under N00014-00-1-0476, N00014-99-1-0495, N00014-98-1-0499, and N00014-94-1-0302 awarded by the Office of Naval Research and DBI-98346603 awarded by the National Science Foundation. The government has certain rights in the invention.",09935776,11543326,"",""
07595376,20090929,Poly zinc finger proteins with improved linkers,11639363,20070149770,20070628,"Polynucleotides encoding chimeric proteins, and methods for their production and use are disclosed. The chimeric proteins comprise a flexible linker between two zinc finger DNA-binding domains, wherein the linker contains eight or more amino acids between the second conserved histidine residue of the carboxy-terminal zinc finger of the first domain and the first conserved cysteine residue of the amino-terminal zinc finger of the second domain.",[Jin-Soo Kim][Carl O. Pabo],[Massachusetts Institute of Technology],"This application is a continuation of U.S. patent application Ser. No. 11/110,594, filed Apr. 20, 2005, issued as U.S. Pat. No. 7,153,949, which is a continuation of U.S. patent application Ser. No. 10/146,221, filed May 13, 2002, issued as U.S. Pat. No. 6,903,185, which is a continuation of U.S. patent application Ser. No. 09/260,629, filed Mar. 1, 1999, issued as U.S. Pat. No. 6,479,626, which claims the benefit under 35 USC &#xA7;119(e)(1) of U.S. Provisional Patent Application No. 60/076,454, filed Mar. 2, 1998, all of which are herein incorporated by reference in their entirety.",20061214,"Work described herein was supported by grants PO1-CA42063, CDR-8803014 and P30-CA14051 from the National Institutes of Health, National Science Foundation and National Cancer Institute, respectively. The U.S. Government has certain rights in the invention. Work described herein was also supported by the Howard Hughes Medical Institute.",11110594,11639363,"",""
07595491,20090929,Methods and systems for the enhancement of terahertz wave generation for analyzing a remotely-located object,11756230,20070263682,20071115,"A method for generating terahertz radiation includes inducing a background plasma in a volume of a gas by focusing a first optical beam in the volume, and generating pulsed terahertz radiation with enhanced generation efficiency by focusing a second time-delayed optical beam in the background plasma. The method may be implemented in a system for detecting and analyzing a remotely-located object.",[Xi-Cheng Zhang][Jianming Dai][Xu Xie],[Rensselaer Polytechnic Institute],"This application claims priority under 35 U.S.C. &#xA7;119 to U.S. Provisional Application No. 60/868,140, filed Dec. 1, 2006, entitled &#x201C;Enhancement of THz Wave Generation From Laser Induced Plasma&#x201D;, which is herein incorporated by reference in its entirety.This application is also a continuation-in-part application of commonly owned pending U.S. patent application Ser. No. 11/610,824 filed Dec. 14, 2006, entitled &#x201C;Method of Analyzing A Remotely-Located Object Utilizing An Optical Technique To Detect Terahertz Radiation&#x201D; which claims priority under 35 U.S.C. &#xA7;119 to U.S. Provisional Application No. 60/754,096, filed Dec. 27, 2005, the entire subject matter of these applications are incorporated herein by reference.",20070531,This invention was made with U.S. Government support under Grant No. ECS-0621522 from the National Science Foundation and Grant No. DAAD 19-02-1-0255 from the Army Research Office. The U.S. Government has certain rights in the invention.,11610824,11756230,"",""
07595679,20090929,Method and apparatus to reduce noise fluctuation in on-chip power distribution networks,11402252,"","","A system-on-chip or other circuit has an on-chip noise-free ground which is added to divert ground noise from the sensitive nodes. An on-chip decoupling capacitor, tuned in resonance with the parasitic inductance of the interconnects, can be provided to add an additional low impedance ground path.",[Mikhail Popovich][Eby G. Friedman][Radu M. Secareanu][Olin L. Hartin],[University of Rochester],"The present application claims the benefit of U.S. Provisional Patent Application No. 60/670,253, filed Apr. 12, 2005, whose disclosure is hereby incorporated by reference in its entirety into the present disclosure.",20060412,The work leading to the present invention was supported in part by the National Science Foundation under Contract No. CCR-0304574 and by the Fulbright Program under Grant No. 87481764. The government has certain rights in the invention.,"","","",""
07596589,20090929,Time-mode analog computation circuits and methods,11104141,20050231398,20051020,A time-mode analog computation circuit is provided. The time-mode analog computation circuit includes one or more inputs for receiving one or more temporal input signals. The time-mode analog computation circuit further includes circuitry for performing a mathematical operation based on the one or more temporal input signals. A result of the mathematical operation is expressed in a timing of an output signal generated by the circuit.,[Vishnu V. Ravinuthula][John G. Harris][Jose A. B. Fortes],"[University of Florida Research Foundation, Inc.]","This application claims the benefit of U.S. Provisional Application No. 60/561,354, filed Apr. 12, 2004, which is incorporated herein by reference.",20050412,The United States government may have certain rights to the invention by virtue of support through National Science Foundation grant no. EIA 0135946 and National Aeronautics and Space Administration grant no. NCC 2-1363.,"","","",""
07597941,20091006,Tubular carbon nano/micro structures and method of making same,10937738,20050238567,20051027,"A method of synthesizing and controlling the internal diameters, conical angles, and morphology of tubular carbon nano/micro structures. Different morphologies can be synthesized included but not limited to cones, straight tubes, nozzles, cone-on-tube (funnels), tube-on-cone, cone-tube-cone, n-staged structures, multijunctioned tubes, Y-junctions, dumbbell (pinched morphology) and capsules. The process is based on changing the wetting behavior of a low melting metals such as gallium, indium, and aluminum with carbon using a growth environment of different gas phase chemistries. The described carbon tubular morphologies can be synthesized using any kind of gas phase excitation such as, but not limited to, microwave excitation, hot filament excitation, thermal excitation and Radio Frequency (RF) excitations. The depositions area is only limited by the substrate area in the equipment used and not limited by the process. The internal diameters of the carbon tubular structures can be varied from a few nm to as high as about 20 microns. The wall thickness is about 10-20 nm. The carbon tubular structures can be formed open on both ends are directly applicable to micro-fluidics. Gallium required for the growth of the carbon tubes can be supplied either as a thin film on the substrate or could be supplied through the gas phase with different precursors such as Tri-methyl gallium. Seamless Y-junctions with no internal obstructions can be synthesized without the need of templates. Multi-channeled junctions can also be synthesized without any internal obstructions. Gallium that partially fills the carbon structures can be removed from the tubes by simple heating in vacuum at temperature above 600°.",[Mahendra Kumar Sunkara][Gopinath Bhimarasetti],"[University of Louisville Research Foundation, Inc.]","This application claims priority from U.S. Provisional application Ser. No. 60/501,553 filed on Sep. 9, 2003.",20040909,This application is part of a government project. The research leading to this invention was supported NSF through Contract/Grant No. 9876259. The United States Government retains certain rights in this invention.,"","","",""
07598087,20091006,Protein imprinted polymers with integrated emission sites,11031318,20050214876,20050929,This invention provides protein or polypeptide imprinted polymers with integrated emission sites (PIPIES) for detecting the presence of a protein or polypeptide analyte comprising templated sites which are specific for the analyte. At or near the templated sites are selectively placed reporter molecules. A method is also disclosed for the preparation of the PIPIES and the use of these for the detection of analytes.,[Frank V. Bright],[The Research Foundation of State University of New York],"This application claims priority to U.S. Provisional Application No. 60/534,735 filed on Jan. 7, 2004, the disclosure of which is incorporated herein by reference.",20050107,This work was funded by Grant Nos. CHE-0078101 and CHE-0315129 from the National Science Foundation. The Government has certain rights in the invention.,"","","",""
07598313,20091006,Amphiphilic polymer capsules and related methods of interfacial assembly,10934084,20050096454,20050505,"Polymer capsules from amphiphilic graft copolymers comprising reactive, hydrophobic polyolefin backbones, and hydrophilic poly(ethylene glycol) (PEG) grafts are produced by self-assembly of the polymers at the oil-water interface, and crosslinking the assembly with bis-cyclooctene PEG derivatives in conjunction with ring-open metathesis polymerization catalysts. The use of the graft copolymer architecture in capsule synthesis provides significant opportunities to tune both the surface properties, in terms of recognition, and the membrane properties, in terms of mechanical strength, encapsulation, and release.",[Todd S. Emrick][Kurt Breitenkamp],[University of Massachusetts],"This application claims priority benefit from provisional application Ser. No. 60/500,549 filed Sep. 5, 2003, the entirety of which is incorporated herein by reference.",20040903,The United States Government has certain rights to this invention pursuant to Grant No. CHE0239486 from the National Science Foundation to the University of Massachusetts.,"","","",""
07598344,20091006,"Composition, method and use of bi-functional biomaterials",10654623,20040127640,20040701,"The present invention includes a bifunctional specificity structure that includes a peptide linker having a first and a second binding domain, wherein the first binding domain is selective for a first biomaterial and the second binding domain is selective for a second biomaterial. The present invention also includes a method of making and identifying the bifunctional structure of the present invention and methods of using the same.",[Angela M. Belcher][Christine J. Schmidt][Kiley P. H. Miller][Archit Sanghvi],"[Board of Regents, The University of Texas System]","This patent application claims benefit of provisional application No. 60/408,528 filed Sep. 4, 2002 to Belcher et al. which is hereby incorporated by reference in its entirety.",20030904,"The United States Federal Government may have certain rights in this invention. The subject matter of the application was carried out in part under Federal Government grant number CTS-0103473 from the National Science Foundation (NSF), Nanoscale Interdisciplinary Research Teams (NIRT).","","","",""
07598363,20091006,Polygonal nanostructures of polynucleic acid multi-crossover molecules and assembly of lattices based on double crossover cohesion,11148423,20060078910,20060413,Robust nucleic acid arrays and lattices are assembled based on double crossover cohesion of polygonal units whose edges are composed of nucleic acid multi-crossover domains.,[Nadrian C. Seeman][Baoquan Ding][Pamela E. Constantinou][Tong Wang][Jens Kopatsch][Xiaoping Zhang][Ruojie Sha][Lisa Israel],[New York University],"The present application claims the benefit of priority under 35 U.S.C. &#xA7;119(e) from provisional U.S. application No. 60/578,306, Jun. 10, 2004, the entire contents of which are incorporated by reference.",20050609,"The experiments reported in this application were supported in part by: the National institute of General Medical Sciences, grant no. GM-29554; the Office of Naval Research, grant no. N00014-98-1-0093; the National Science Foundation, grant nos. DMI-0210844, EIA-0086015, DMR-01138790 and CTS-0103002; and DARPA/AFSOR, grant no. F30602-01-2-0561. The U.S. Government has a paid-up license in this invention and the right in limited circumstances to require the patent owner to license others on reasonable terms as provided for by the terms of the above grants.","","","",""
07598513,20091006,"SiSnGeand related alloy heterostructures based on Si, Ge and Sn",10559979,20060163612,20060727,"A novel method for synthesizing device-quality alloys and ordered phases in a Si—Ge—Sn system uses a UHV-CVD process and reactions of SnDwith SiHGeH. Using the method, single-phase SiSnGesemiconductors (x≦0.25, y≦0.11) are grown on Si via GeSnbuffer layers The GeSnbuffer layers facilitate heteroepitaxial growth of the SiSnGefilms and act as compliant templates that can conform structurally and absorb the differential strain imposed by the more rigid Si and Si—Ge—Sn materials. The SiHGeHspecies was prepared using a new and high yield method that provided high purity semiconductor grade material.",[John Kouvetakis][Matthew Bauer][John Tolle],[],"This application is based on and claims the benefit of U.S. Provisional Patent Application No. 60/478,480 filed on Jun. 13, 2003, the disclosure of which is incorporated herein by this reference.",20040614,"The United States Government provided financial assistance for this project through the National Science Foundation under Grant No. DMR 0221993, through the Army Research Office under Grant No. DAA 19-00-1-0471 and through Air Force Research Laboratory/SNHC under Grant No. F19628-03-C-0056. Therefore, the United States Government may own certain rights to this invention.","","",20051208,PCT/US2004/018969
07598514,20091006,Quasi-particle interferometry for logical gates,12128417,20080224726,20080918,"A quantum computer can only function stably if it can execute gates with extreme accuracy. “Topological protection” is a road to such accuracies. Quasi-particle interferometry is a tool for constructing topologically protected gates. Assuming the corrections of the Moore-Read Model for ν=5/2's FQHE (Nucl. Phys. B 360, 362 (1991)) we show how to manipulate the collective state of two e/4-charge anti-dots in order to switch said collective state from one carrying trivial SU(2) charge, |1&gt;, to one carrying a fermionic SU(2) charge |ε&gt;. This is a NOT gate on the {|1&gt;, |ε&gt;} qubit and is effected by braiding of an electrically charged quasi particle σ which carries an additional SU(2)-charge. Read-out is accomplished by σ-particle interferometry.",[Michael H. Freedman][Chetan V. Nayak][Sankar Das Sarma],[Microsoft Corporation],"This application is a division of U.S. patent application Ser. No. 11/544,492, filed on Oct. 6, 2006, which is a division of U.S. patent application Ser. No. 11/233,653, filed on Sep. 23, 2005, now U.S. Pat. No. 7,250,624. The disclosure of each of the above-referenced patent applications is incorporated herein by reference.",20080528,"This invention was supported in part by funds from the U.S. Government (National Science Foundation Grant No. DMR-0411800 and Army Research Office Grant No. W911NF-04-1-236). The U.S. Government, therefore, may have certain rights in this invention.",11544492,12128417,"",""
07598723,20091006,Method and apparatus for detecting resonance in electrostatically driven elements,11354268,20060255790,20061116,"A method and system is disclosed that can be used to directly detect and analyze an electric signal electrostatically induced a semi-conductive or conductive element at resonance. Through detection of the changes in the characteristics of the signal from the element, the disclosed devices can detect, for instance, presence of chemical/biological species in a sample or measure physical parameters of a sample such as pressure/acceleration, magnetic force, temperature, and/or extremely small masses. The disclosed systems include one or more micro- or nano-sized elements. Through modulation of an electric charge on a counter-electrode that is located at a pre-determined distance from the element, a modulating charge can be induced upon the element. Resonance can be directly detected via electronic monitoring of the induced signal for the higher harmonics of the natural resonant frequency.",[Jay Gaillard][Razvan Marian Ciocan][Malcolm Skove][Apparao M. Rao],[],"This application claims benefit of Provisional Application Ser. No. 60/652,754, filed on Feb. 14, 2005 and claims benefit of Provisional Application Ser. No. 60/708,149 filed on Aug. 15, 2005.",20060214,The United States Government may have rights in this invention pursuant to National Science Foundation Grant No. 2003863.,"","","",""
07599069,20091006,Vector beam generator using a passively phase stable optical interferometer,11418694,20060268408,20061130,"Provided are techniques for generating optical vector beams (e.g., radially and azimuthally polarized light) using passive or active phase stable optical interferometry. Techniques may split an input optical beam into at least two output beams, and then couple those beams simultaneously into a passively phase stable optical interferometer. Beam splitting may be achieved by a diffractive optical element and coupling may be achieved by a single refractive optical device (lenses) or by a single mirror device (e.g., parabolic and spherical). The interferometer may provide the ability to manipulate (or transform) the polarization of part of the wavefront of each beam, as well as the ability to manipulate (or transform) the phase of part of the wavefront of each beam, such that the beams when combined have a vector beam polarization state.","[Kimani C. Toussaint, Jr.][Norbert F. Scherer][Justin E. Jureller][Sungnam Park]",[The University of Chicago],"This application claims the benefit of U.S. Provisional Application No. 60/678,344, filed May 6, 2005, the entirety of which is expressly incorporated herein by reference.",20060505,Scientific work relating to the invention was supported by Grant Nos. CHE0321232 and CHE0317009 from the United States National Science Foundation and by Grant No. DMR0213745 from the United States National Science Foundation&#x2014;Materials Research Science &amp; Engineering Centers. The United States government may have certain rights in the invention.,"","","",""
07599876,20091006,Electronic market-maker,09526633,"","","Disclosed herein is an automated Electronic Market-Maker, comprising a Market Quality Control Module for generating trading recommendations to maintain market quality; an Inventory Control Module for generating trading recommendations to maintain inventory; a Speculation Module for generating trading recommendations to generate profits; and an Arbitration Module to receive trading recommendations from said Market Quality Control Module, Inventory Control Module, and Speculation Control Module and resolve any conflicts between the received recommendations.",[Andrew Lo][Tung Chan][Tomaso Poggio],[Massachusetts Institute of Technology],"The present patent application is based upon Provisional Application No. 60/124,579, filed on Mar. 16, 1999, entitled ELECTRONIC MARKET-MAKER, by Andrew Lo, Tung Chan and Tomaso Poggio, the disclosure of which is incorporated herein by reference.",20000315,This invention was made with government support under Grant Number ASC-9217041 awarded by the National Science Foundation. The government has certain rights in the invention.,"","","",""
