patentno,patpubdate,title,appno,priorpub,priorpubdate,abstract,invs,assignee,xref,filedate,govint,parentcase,childcase,date371,pctpubno
07560641,20090714,Thin film solar cell configuration and fabrication method,10460872,20030230338,20031218,"A new photovoltaic device configuration based on an n-copper indium selenide absorber and a p-type window is disclosed. A fabrication method to produce this device on flexible or rigid substrates is described that reduces the number of cell components, avoids hazardous materials, simplifies the process steps and hence the costs for high volume solar cell manufacturing.",[Shalini Menezes],[],"A provisional Patent Application No. 60/431,268, entitled &#x201C;Flexible Solar Cell Configuration and Fabrication Method&#x201D; was filed on Dec. 6, 2002 with the US Patent and Trademark Office.An Invention Disclosure entitled &#x201C;New Approach and Configuration for a Low Cost Flexible CIS Thin film Solar Cell&#x201D; conceived by Dr. Shalini Menezes was documented and witnessed on Jun. 29, 2000.",20030614,This invention was partly reduced to practice with Government support under a SBIR grant awarded by NSF and an EISG grant awarded by the California Energy Commission. The Government has certain rights in the invention.,"","","",""
07560658,20090714,Method for forming nanoscale features,11167463,20060237405,20061026,"Here is presented a versatile technique for machining of nanometer-scale features using tightly-focused ultrashort laser pulses. By the invention, the size of features can be reduced far below the wavelength of light, thus enabling nanomachining of a wide range of materials. The features may be extremely small (&lt;20 nm) and are highly reproducible.",[Alan J. Hunt][Gerald Mourou][Ajit P. Joglekar][Edgar Meyhofer][John A. Nees][Greg Spooner],[The Regents Of The University Of Michigan],"This application is a divisional of U.S. patent application Ser. No. 10/765,656 filed on Jan. 26, 2004, which itself claims benefit of U.S. Provisional Application No. 60/443,431, filed on Jan. 29, 2003. The disclosures of the above applications are incorporated herein by reference.",20050627,This invention was made with government support provided by the National Science Foundation (Grant Nos. 8920108 and 0133659). The government has certain rights in the invention.,10765656,11167463,"",""
07561624,20090714,Multi-interval line coding for high speed data communication,10994465,20060109917,20060525,"Binary data signal multi-line interval encoding and decoding arrangements supporting high speed data communications consistent with certain embodiments produce a signal having a plurality of pulses with a minimum pulse duration of T. The pulses are arranged in a signal pattern selected as one of M possible signal patterns of L bits transmitted over N time intervals, with each time interval being of T seconds in duration, to represent one of M possible message sequence, where M&gt;2. The plurality of pulses have transitions that occur at times falling between the boundaries of the time interval T. Embodiments may be implemented in hardware, with a computer executing a software program within, or with both. This abstract is not to be considered limiting, since other embodiments may deviate from the features described in this abstract.",[John P. Fonseka][Jin Liu],"","",20041122,The U.S. Government has a paid-up license in this invention and the right in limited circumstances to require the patent owner to license others on reasonable terms as provided for by the terms of contract No. ECS-0120396 awarded by the National Science Foundation.,"","","",""
07561633,20090714,System and method for MIMO equalization for DSP transceivers,11487067,20070014378,20070118,"A method to efficiently deal with FEXT crosstalk in wireline communication system via MIMO equalization is presented. A MIMO-DFE based receiver architecture is developed to demonstrate the advantage over the traditional receiver design. A MIMO structure for systems with TH precoding is also developed for 10GBASE-T application. The proposed architecture overcomes the limitation of the traditional schemes and achieves a better SNR performance and lower receiver complexity. The proposed method relies on the fact that FEXT inherently contains information about the symbols transmitted from the three far end transmitters and it can be viewed as a signal rather than noise. Therefore, MIMO techniques are applied to turn FEXT into a benefit for the receiver design.",[Keshab K. Parhi][Yongru Gu],[Leanics Corporation],"This application claims the benefit of U.S. Provisional Application No. 60/699,169, filed on Jul. 13, 2005, the entire content of which is incorporated herein by reference in its entirety.",20060713,"This invention was made with Government support under the SBIR Grant No. DMI-0441632, awarded by the National Science Foundation (NSF). The Government has certain rights in this invention.","","","",""
07561972,20090714,Synthetic nucleic acids for expression of encoded proteins,12184234,"","","A method of designing a polynucleotide sequence encoding a polypeptide sequence of a predetermined polypeptide is provided. A frequency lookup table corresponding to an expression system is obtained. The table comprises a plurality of sequence elements and a plurality of frequency ranges, each frequency range for a corresponding sequence element. Each frequency range is a range of frequencies with which a corresponding sequence element can occur in a polynucleotide. The polynucleotide sequence is defined using the frequency lookup table by determining, for each respective sequence element in the frequency lookup table, whether the respective sequence element encodes a portion of the polypeptide sequence. When the respective sequence element encodes a portion of the polypeptide sequence, the sequence element is incorporated into the polynucleotide at a frequency of occurrence that is within the frequency range specified for the respective sequence element in the lookup table. The polynucleotide sequence is then outputted.",[Mark Welch][Claes Gustafsson],"[DNA Twopointo, Inc.]","This application claims priority to U.S. Provisional Patent Application No. 61/131,238,&#x201D; filed Jun. 6, 2008, which is hereby incorporated by reference herein. This application also claims priority to U.S. Provisional Patent Application No. 61/131,180,&#x201D; filed Jun. 6, 2008, which is hereby incorporated by reference herein.",20080731,The research described in this application was funded in part by NSF SBIR grant 0638333.,"","","",""
07561973,20090714,Methods for determining properties that affect an expression property value of polynucleotides in an expression system,12184240,"","","A method of determining a property that affects expression of polynucleotides in an expression system. A plurality of polynucleotides, each encoding a polypeptide sequence, is constructed. An amino acid is encoded a plurality of times in both a first and second polynucleotide in the plurality. The amino acid is encodable by a plurality of synonymous codons including a first codon. The first codon is in the first polynucleotide at a first frequency relative to other synonymous codons, and is in the second polynucleotide at a second frequency relative to other synonymous codons. The first and second frequencies are different. Each polynucleotide is individually expressed in the expression system to measure an expression property value of the polynucleotides, thereby determining a property that affects expression of polynucleotides. The property is an effect that a frequency of use of one or more codons has on expression of polynucleotides in the expression system.",[Mark Welch][Claes Gustafsson],"[DNA Twopointo, Inc.]","",20080731,The research described in this application was funded in part by NSF SBIR grant 0638333.,"","","",""
07563451,20090721,Capped mesoporous silicates,10830479,20060154069,20060713,"The invention provides an article comprising, a mesoporous silicate matrix, such as a particle, having one or more pores; and one or more releasable caps obstructing one or more of the pores. The articles are useful as delivery vehicles for encapsulated agents such as therapeutic agents, polynucleotides, polypeptides and the like.",[Victor Shang-Yi Lin][Cheng-Yu Lai][Srdija Jeftinija][Dusan M. Jeftinija],"[Iowa State University Research Foundation, Inc.]","This application claims priority under 35 U.S.C. &#xA7; 119(e) to U.S. Provisional Patent Application No. 60/489,043 filed Jul. 22, 2003, which application is incorporated herein by reference.",20040422,This invention was made with Government support under NSF Contract No. CHE-0239570. The United States Government has certain rights in this invention.,"","","",""
07563457,20090721,Nanoparticle assembled hollow spheres,10263271,20030082237,20030501,"A design strategy for constructing hierarchically structured materials using nanoparticles and synthetic biopolymers has been developed. Block copolypeptides or homopolymer polyelectrolytes are used as structure-directing agents to arrange nanoparticles (composed of metals, metal non-oxides, metal oxides, or organics) into unusual microstructures, such as spheres, “apples” and “cups.” Hollow spheres can be made wherein nanoparticles of one composition are spatially oriented completely interior or exterior to nanoparticles of a second composition. These aggregates contain nanoparticles only in the shell walls, and maintain their hollowness upon calcination. These shapes can also be fabricated into films. These robust materials are anticipated to have great promise in applications that require surface catalysis, magnetic/electronic/optic properties, transport capabilities, and combinations thereof, such as drug delivery, packaging, catalysis, and sensors.",[Jennifer Cha][Timothy J. Deming][Galen D. Stucky][Michael Wong][Henrik Birkedal][Michael H. Bartl][Jan L. Sumerel],[The Regents of the University of California],"The present application claims the benefit of U.S. provisional application No. 60/326,870 filed Oct. 2, 2001 as well as U.S. provisional application No. 60/360,939, filed Mar. 1, 2002, both of which are incorporated herein by reference in their entirety.",20021002,"This invention was made with Government support under Grant Nos. 0090034 and 9634396, awarded by the National Science Foundation. The Government has certain rights in this invention.","","","",""
07564120,20090721,Electrical passivation of silicon-containing surfaces using organic layers,11219172,20060006433,20060112,"Electrical structures and devices may be formed and include an organic passivating layer that is chemically bonded to a silicon-containing semiconductor material to improve the electrical properties of electrical devices. In different embodiments, the organic passivating layer may remain within finished devices to reduce dangling bonds, improve carrier lifetimes, decrease surface recombination velocities, increase electronic efficiencies, or the like. In other embodiments, the organic passivating layer may be used as a protective sacrificial layer and reduce contact resistance or reduce resistance of doped regions. The organic passivation layer may be formed without the need for high-temperature processing.",[Nathan S. Lewis][William J. Royea],[California Institute of Technology],"This application is a divisional and claims priority to U.S. patent application Ser. No. 09/905,157, filed Jul. 12, 2001, now U.S. Pat. No. 7,491,642 which claims priority under 35 U.S.C. &#xA7;119(e) to U.S. patent application Ser. No. 60/217,749 entitled &#x201C;Electrical Passivation of Silicon-containing surfaces Using Organic Layers&#x201D; by Lewis et al. filed Jul. 12, 2000. This application is also related to U.S. patent application Ser. No. 09/305,125 entitled &#x201C;Stabilization of Si Photoanodes in Aqueous Electrolytes Through Surface Alkylation&#x201D; by Lewis et al. filed May 4,1999. Both applications are assigned to the current assignee hereof and incorporated herein by reference.",20050902,The U.S. Government has certain rights in this invention pursuant to Grant No. CHE-9974562 and CHE-9634152 awarded by the National Science Foundation.,09905157,11219172,"",""
07564559,20090721,"MEMS-based, phase-shifting interferometer",11446552,20070279638,20071206,"Provided herein are optical devices fabricated to include a reflective surface, actuators and stress-relieving structures. Systems containing such devices, and methods of manufacturing such devices, are also provided.",[Hyuck Choo][Richard S. Muller][David Garmire][James W. Demmel][Rishi Kant],[The Regents of the University of California],"",20060602,The invention was funded in part by Grant Nos. EIA-0122599 awarded by the National Science Foundation and by Grant No. EEC-0318642 awarded by the National Science Foundation. The government may have certain rights in the invention.,"","","",""
07564943,20090721,Method and apparatus for sorting materials according to relative composition,11498694,20070030953,20070208,"Disclosed herein is a metal sorting device including an X-ray tube, a dual energy detector array, a microprocessor, and an air ejector array. The device senses the presence of samples in the x-ray sensing region and initiates identifying and sorting the samples. After identifying and classifying the category of a sample, at a specific time, the device activates an array of air ejectors located at specific positions in order to place the sample in the proper collection bin.","[Edward J. Sommer, Jr.][Charles E. Roos][David B. Spencer][R. Lynn Conley]","[Spectramet, LLC]","This application is a continuation-in-part application of U.S. patent application Ser. No. 11/069,243, filed Mar. 1, 2005, now U.S. Pat. No. 7,099,433, entitled &#x201C;Method and Apparatus for Sorting Materials According to Relative Composition,&#x201D; which is hereby incorporated by reference, which claims benefit of U.S. Provisional Patent Application Ser. No. 60/549,089, filed Mar. 1, 2004, entitled &#x201C;High speed non-ferrous metal sorting using XRF&#x201D; which is hereby incorporated by reference in its entirety.",20060803,This invention was made with federal grant money under National Science Foundation Small Business Innovation Research program under grant number DMI-0239055. The United States Government has certain rights in this invention.,11069243,11498694,"",""
07565340,20090721,Methods for assisting computer users performing multiple tasks,11443503,20070162907,20070712,"A method for assisting multi-tasking computer users includes receiving from a user a specification of a task being performed by the user or an indication of completion of a task, collecting state changes in multiple executing programs, predicting a current task being performed by the user based on a recent state change event, a past specification of a task being performed by the user, and past events and associated tasks. Based on the predicted current task, user interface elements in multiple executing programs are adapted to facilitate performance of the task. The method may also allow a user to specify a new task based on a task template derived from a completed task to facilitate completion of the new task. The task templates also may be shared among users, and active tasks may also be team tasks shared among users.",[Jonathan L. Herlocker][Thomas G. Dietterich],[The State of Oregon Acting by and through the State Board of Higher Education on Behalf of Oregon State University],"This application claims priority from U.S. provisional patent application No. 60/757596 filed Jan. 9, 2006, which is incorporated herein by reference.",20060530,This invention was supported in part by the National Science Foundation under contract/grant number IIS-133994 and DARPA grant no. HR0011-04-1-0005 and DARPA contract no. NBCHD030010. The U.S. Government has certain rights to the invention.,"","","",""
07566476,20090728,Highly luminescent color-selective nanocrystalline materials,11502493,20060275544,20061207,A nanocrystal capable of light emission includes a nanoparticle having photoluminescence having quantum yields of greater than 30%.,[Moungi G. Bawendi][Klavs F. Jensen][Bashir O. Dabbousi][Javier Rodriquez-Viejo][Frederic Victor Mikulec],[Massachusetts Institute of Technology],"This application is a divisional of U.S. patent application Ser. No. 10/960,947, filed Oct. 12, 2004, now U.S. Pat. No. 7,125,605 which is a continuation of U.S. patent application Ser. No. 10/642,578, filed on Aug. 19, 2003, now U.S. Pat. No. 6,861,155, which is a continuation of U.S. patent application Ser. No. 09/625,861, filed on Jul. 26, 2000, now U.S. Pat. No. 6,607,829, which claims priority to U.S. Patent Application Ser. No. 60/145,708, filed on Jul. 26, 1999, and is a continuation-in-part of U.S. patent application Ser. No. 08/969,302, filed Nov. 13, 1997, now U.S. Pat. No. 6,322,901, each of which is hereby incorporated by reference.",20060811,This invention was made with government support under Contract No. DMR-94-00334 from the National Science Foundation. The government has certain rights in the invention.,10960947,11502493,"",""
07567715,20090728,System and method for representing and encoding images,11128408,"","","A system and method for representing and encoding an input image. Pixels associated with the structural part of the image are referred to as “sketchable,” and pixels associated with the texture part are referred to as “non-sketchable.” A sketch graph, S, is generated for the sketchable part of the input image by iteratively selecting a plurality of optimal image primitives from a dictionary of image primitives. The sketch graph may then be refined to achieve good Gestalt organization and resolve ambiguities in the graph. The non-sketchable texture regions of the image, S, are computed via a simple texture clustering algorithm. In reconstructing the sketchable part of the input image, the image primitives are aligned on the sketch graph. In reconstructing the non-sketchable part of the input image, the MRF models are simulated to reproduce statistical summaries of the various texture regions using the sketchable part as boundary condition.",[Song-Chun Zhu][Cheng-en Guo][Ying-Nian Wu],[The Regents of the University of California],"This application claims the benefit of U.S. Provisional Application No. 60/570,385 filed on May 12, 2004, the content of which is incorporated herein by reference.",20050512,"This invention was made with Government support under Grant Nos. 0222467 and 9877127, awarded by the National Science Foundation (NSF). The Government has certain rights in this invention.","","","",""
07567740,20090728,Thermal sensing fiber devices,11529111,20090097805,20090416,"There is provided a thermal sensing fiber including a semiconducting element having a fiber length and characterized by a bandgap energy corresponding to a selected operational temperature range for the fiber in which there can be produced a change in thermally-excited electronic charge carrier population in the semiconducting element in response to a temperature change in the selected temperature range. At least one pair of conducting electrodes is provided in contact with the semiconducting element along the fiber length, and an insulator is provided along the fiber length.",[Mehmet Bayindir][Fabien Sorin][Ayman F. Abouraddy][Ofer Shapira][Jerimy R. Arnold][Yoel Fink][John D. Joannopoulos],[Massachusetts Institute of Technology],"This application claims the benefit of U.S. Provisional Application No. 60/721,277, filed Sep. 28, 2005, and U.S. Provisional Application No. 60/758,427, filed Jan. 12, 2006, the entirety of both of which are hereby incorporated by reference. This application is a continuation in part of U.S. application Ser. No. 10/890,948, filed Jul. 14, 2004, now U.S. Pat. No. 7,295,734, which in turn claims the benefit of U.S. Provisional Application No. 60/487,125, filed Jul. 14, 2003, and U.S. Provisional Application No. 60/539,470, filed Jan. 27, 2004, the entirety of all of which are hereby incorporated by reference. This application is related to U.S. application Ser. No. 11/173,827, filed Jul. 1, 2005, now U.S. Pat. No. 7,292,758, the entirety of which is hereby incorporated by reference.",20060928,"This invention was made with Government support under Contract No. DAAD19-03-1-0357, awarded by DARPA, under Contract No. DMR 02-13282 awarded by the NSF, and under Contract No. DE-FG02-99ER45778 awarded by DOE. The Government has certain rights in the invention.",10890948,11529111,"",""
07568365,20090804,"Method and apparatus for micromachining bulk transparent materials using localized heating by nonlinearly absorbed laser radiation, and devices fabricated thereby",10136160,20020162360,20021107,"Thermal 3-D microstructuring of photonic structures is provided by depositing laser energy by non-linear absorption into a focal volume about each point of a substrate to be micromachined at a rate greater than the rate that it diffuses thereout to produce a point source of heat in a region of the bulk larger than the focal volume about each point that structurally alters the region of the bulk larger than the focal volume about each point, and by dragging the point source of heat thereby provided point-to-point along any linear and non-linear path to fabricate photonic structures in the bulk of the substrate. Exemplary optical waveguides and optical beamsplitters are thermally micromachined in 3-D in the bulk of a glass substrate. The total number of pulses incident to each point is controlled, either by varying the rate that the point source of heat is scanned point-to-point and/or by varying the repetition rate of the laser, to select the mode supported by the waveguide or beamsplitter to be micromachined. A wide range of passive and active optical and other devices may be thermally micromachined.",[Chris Schaffer][André  Brodeur][Rafael R. Gattass][Jonathan B. Ashcom][Eric Mazur],[President &amp; Fellows of Harvard College],"This invention is related to U.S. provisional application of Schaffer et al., Ser. No. 60/288,890, filed May 4, 2001, and incorporated herein by reference.",20020501,The U.S. government may have rights in the present invention under contract numbers DMR-94-00396 and DMR-98-09363 from the National Science Foundation.,"","","",""
07568712,20090804,Height and width adjustable saddle sling seat walker with controllable directional tracking and optional arm supports,11594687,20070107761,20070517,"The invention relates to a walker having a main supporting frame, a superstructure frame and a body support means. The superstructure frame is operatively arranged for vertical adjustment relative to the main supporting frame and includes an adjustable interior opening for accommodating a user and an entrance gate operatively arranged to provide access to the adjustable interior opening. The body support means is secured to the superstructure frame and operatively arranged to support the user. Furthermore, the walker may include four wheels, each of which may include a directional locking apparatus and/or braking system, and the walker may include at least one arm support operatively arranged for supporting the user. The walker may also include at least one handle operatively arranged for transmission of the walker.",[Peter Kovachi][Joseph C. Mollendorf][Roger Teagarden][Chee Main Heam],[The Research Foundation of State University of NY],"This patent application claims the benefit under 35 U.S.C. &#xA7;119(e) of U.S. Provisional Application No. 60/735,160, filed Nov. 9, 2005, which application is incorporated herein by reference.",20061108,The United States Government has a paid-up license in this invention and the right in limited circumstances to require the patent owner to license others on reasonable terms as provided for by the terms of Grant No. BES-0436538 awarded by the National Science Foundation.,"","","",""
07569340,20090804,"Nanoarrays of single virus particles, methods and instrumentation for the fabrication and use thereof",11506200,20070129321,20070607,"A nanoarray template utilizing coordination chemistry or metal ion binding to control the site-isolation and orientation of virus particles is provided. The nanoarray template is generated by lithography including Dip Pen Nanolithography. The surface chemistry that is inherent in many viruses, metal-ion based or inorganic coordination chemistry is used to immobilize individual virus particles without the need for their genetic modification. Single particle control enables a wide variety of studies involving viruses that are not possible with microarrays, including single particle, single cell infectivity studies, exploration of such structures as templates in materials synthesis and molecular electronics, and studies aimed at understanding how surface presentation influences their bioactivity. This is an example of such control at the single-particle level, and therefore, commercial use of nanoarrays in biological systems.",[Chad A. Mirkin][Rafael A. Vega][Daniel Maspoch][Khalid Salaita],[Northwestern University],"This application claims priority benefit to provisional application Ser. No. 60/712,432 filed Aug. 31, 2005 to Mirkin, et al., which is hereby incorporated by reference in its entirety.",20060818,This invention was made with government support under following grants: Air Force Office of Science Research (AFOSR) grant MURI F49620-00-1-0283; NIH grant 1DP1OD000285-01; NSF/NSEC grant EEC-0118025; DARPA/AFOSR grant FA9550-05-1-0348; and ARO-MURI 28065-3-A1//W91NF-04-1-071. The government has rights in this invention.,"","","",""
