patentno,patpubdate,title,appno,priorpub,priorpubdate,abstract,invs,assignee,xref,filedate,govint,parentcase,childcase,date371,pctpubno
07472894,20090106,Engine carburetion,11426946,20080001315,20080103,"An emulsion tube for a carburetor is formed with a porous wall surrounding an inner passage, wherein air travels about one side of the wall and fuel travels about the opposite side, with air being supplied through the pores to aerate the fuel (with the aerated fuel then being expelled into a venturi wherein engine intake air is traveling to further mix the fuel with the intake air therein). The emulsion tube can beneficially provide a high degree of fuel/air mixing across the entire range of intake airstream flow rates at which an engine may operate. The porosity of the emulsion tube can also be tailored to provide the desired fuel/air ratio(s) across the engine's operational range of intake airstream flow rates.",[Timothy A. Shedd][Wayne L. Staats][Terry L. Hendricks],[Wisconsin Alumni Research Foundation],"",20060628,This invention was made with United States government support awarded by the following agencies:NSF Grant No(s).: 0134510The United States has certain rights in this invention.,"","","",""
07473028,20090106,Method and device for investigation of phase transformations in metals and alloys,11410277,"","","A device and method for investigating phase transformation properties and structural changes of materials. In one form, the device simulates actual thermal processing conditions, while the method can be used in both simulations as well as in actual processing conditions. An analysis using at least one of the device and method is referred to as a single sensor differential thermal analysis, as it compares the temperature recorded in a measured specimen against a reference thermal history without requiring the derivation of the reference thermal history from measured reference temperatures.",[Boian Todorov Alexandrov][John C. Lippold][Seth Jason Norton],[The Ohio State University],"This application claims the benefit of the filing date of U.S. Provisional Application No. 60/673,879, filed Apr. 22, 2005.",20060424,This invention was supported by the government under Contract No. DGE-0312160 awarded by the National Science Foundation (NSF). The government has certain rights in the invention.,"","","",""
07473411,20090106,Carbon nanotube foam and method of making and using thereof,11005474,20060073089,20060406,"A method of making a carbon nanotube structure includes providing an array of substantially aligned carbon nanotubes, wetting the array with a liquid, and evaporating the liquid to form the carbon nanotube structure having a pattern in the carbon nanotube array. The structure is preferably a carbon nanotube foam.",[Pulickel Ajayan][Alvaro Carrillo][Nirupama Chakrapani][Ravi S. Kane][Bingqing Wei],[Rensselaer Polytechnic Institute],"",20041207,The U.S. government may have certain rights in this invention pursuant to grant number DMR-0408745 from the National Science Foundation and the NSEC.,"","","",""
07473786,20090106,Methods and systems for preparing fused heterocyclic compounds using copper(I) catalysts,11005365,"","","A copper(I)-catalyzed procedure for the synthesis of benzo[b]heterocycles. This protocol can be used to synthesize a variety of 2-arylbenzo[b]furans and indoles in good to excellent yields. This method can tolerate a variety of functional groups, does not require the use of expensive additives and is palladium-free.",[Dhandapani Venkataraman][Craig G. Bates][Pranorm Saejueng],[University of Massachusetts],"This application claims priority benefit from application Ser. No. 60/527,559 filed Dec. 5, 2003, the entirety of which is incorporated herein by reference.",20041206,The United States government has certain rights to this invention pursuant to Grant No. CHE-0134287 form the National Science Foundation to the University of Massachusetts.,"","","",""
07473797,20090106,"Methods of 1,3-enyne preparation using copper (I) catalysts",11115502,20050255575,20051117,"A copper(I) bi-dentate ligand complex-catalyzed procedure for synthesis of 1,3-enynes. The methods and/or systems of this invention afford a variety of enynes, tolerate a variety of sensitive functional groups, and can be employed without resort to expensive palladium reagents.",[Dhandapani Venkataraman][Craig G. Bates][Pranorm Saejueng],[University of Massachusetts],"This application claims priority benefit of U.S. application Ser. No. 60/565,620, filed Apr. 27, 2004, the entirety of which is incorporated herein by reference.",20050427,The United States government has certain rights to this invention pursuant to Grant No. CHE-0134287 from the National Science Foundation to the University of Massachusetts.,"","","",""
07473914,20090106,System and method for producing terahertz radiation,11186429,20060022151,20060202,"An apparatus for producing an annular electron beam comprises a cathode for generating electrons, a cavity having an annular shape and operable to receive the electrons, an energy input coupled to the cavity, where the energy input is operable to supply Radio Frequency (RF) energy at the cavity and an energy output coupled to the cavity and operable to receive accelerated electrons from the cavity and operable to output the accelerated electrons as an annular electron beam.","[Alan M. Todd][Hans Peter Bluem][Robert Henry Jackson, Jr.]","[Advanced Energy Systems, Inc.]","This is a continuation-in-part of U.S. patent application, entitled SYSTEM AND METHOD FOR PRODUCING TERAHERTZ RADIATION, and Ser. No. 10/903,840, filed Jul. 30, 2004 by Alan M. Todd, et al.",20050721,The subject matter of this application is related to a Small Business Innovation Research project funded by the National Science Foundation under award number 0318910. The government may have certain rights in this invention.,10903840,11186429,"",""
07474657,20090106,Partitioning methods for dynamic router tables,10718842,20040141509,20040722,"Systems and methods for improving the performance of dynamic router table data structures are provided. The invention relates to methods and systems for partitioning prefixes or prefix-based intervals. In one embodiment, priority search tree router data structures are applied to prefix partitions of the present invention. In another embodiment, basic-interval tree and prefix tree data structures are applied to interval partitions of the present invention.",[Sartaj Kumar Sahni][Haibin Lu][Kun Suk Kim],"[University of Florida Research Foundation, Inc.]","This application is a continuation-in-part application of co-pending U.S. application Ser. No. 10/426,423, filed Apr. 30, 2003; which claims the benefit of U.S. Provisional application No. 60/376,853, filed Apr. 30, 2002.",20031121,"This invention was made in part with funding under a funding grant, No. CCR9912395, from the National Science Foundation. The government has certain rights in the invention.",10426423,10718842,"",""
07476257,20090113,Methods to engineer stratified cartilage tissue,10244035,20030077821,20030424,"The present invention is directed to a cultured, stratified cartilage tissue that comprises a tissue-engineered, cohesive cartilage construct comprised of two or more cartilage layers, wherein each cartilage layer comprises chondrogenic cells having a chondrocytic phenotype corresponding to chondrocytes present in: a superficial-tangential zone of natural cartilage; a middle-transitional zone of natural cartilage; a deep-radial zone of natural cartilage; or a calcified cartilage zone of natural cartilage.",[Robert L. Sah][Kelvin W. Li][Travis J. Klein][Barbara L. Schumacher][Koichi Masuda][Eugene J-M. A. Thonar],[Rush University Medical Center][The Regents of the University of California],"This application claims priority to U.S. patent applications Ser. No. 60/322,888, filed Sep. 15, 2001 and 60/382,438, filed May 22, 2002, the entire contents of both of which are hereby entirely incorporated by reference.",20020913,This invention was made with government support under Grant Number BES-9987353 awarded by the National Science Foundation. The government has certain rights in the invention.,"","","",""
07476345,20090113,Layer by layer self-assembly of large response molecular electro-optic materials by a desilylation strategy,11054962,20060088717,20060427,"The preparation of robust, thin film materials with large second-order optical nonlinearities through the covalent self-assembly of chromophoric compositions and innovative use of silyl chemistry.",[Tobin J. Marks][Milko E. van der Boom],[Northwestern University],"This application is a division of and claims priority benefit from application Ser. No. 09/815,951 filed Mar. 22, 2001, and to issue as U.S. Pat. No. 6,855,274 on Feb. 15, 2005, which in turn claim priority benefit from provisional application Ser. No. 60/191,360, filed on Mar. 22, 2000, the entirety of each is incorporated herein by reference.",20050210,"The United States government has rights in this invention pursuant to Grant No. DMR 9632472 from the National Science Foundation and Grant No. ONR N00014-95-1-1219 from the Office of Naval Research, both to Northwestern University.",09815951,11054962,"",""
07476500,20090113,In vivo selection system for enzyme activity,10102056,"","","The present invention provides in vivo systems in which activity of a biological cleavage enzyme, such as a site-specific recombinase, a homing endonuclease, or an intein, is linked to cell viability and therefore can be selected. The invention further provides methods of making cells in which the activity of a biological cleavage enzyme is linked to viability, as well as methods of identifying new biological cleavage enzymes, including enzymes having altered site specificity, using such cells.",[David R. Liu][Zev Gartner][Daniel M. Rosenbaum][Mathias Gruen][Jeffrey Doyon],[President and Fellows of Harvard College],"The present application claims priority under 35 U.S.C. &#xA7; 119(e) to U.S. Provisional patent applications 60/277,094, filed Mar. 19, 2001, entitled &#x201C;Approaches to Generating New Molecular Function&#x201D;; 60/306,691, filed Jul. 20, 2001, entitled &#x201C;Approaches to Generating New Molecular Function&#x201D;, and 60/353,565, filed Feb. 1, 2002, entitled &#x201C;In Vivo Selection System for Homing Endonuclease Activity&#x201D; and the entire contents of each of these applications are hereby incorporated by reference.",20020319,This invention was sponsored by NSF grant no. MCB-0094128 and the government has certain rights to the invention.,"","","",""
07476596,20090113,"Doped elongated semiconductors, growing such semiconductors, devices including such semiconductors, and fabricating such devices",11543336,20070032051,20070208,"A bulk-doped semiconductor that is at least one of the following: a single crystal, an elongated and bulk-doped semiconductor that, at any point along its longitudinal axis, has a largest cross-sectional dimension less than 500 nanometers, and a free-standing and bulk-doped semiconductor with at least one portion having a smallest width of less than 500 nanometers. At least one portion of such a semiconductor may a smallest width of less than 200 nanometers, or less than 150 nanometers, or less than 100 nanometers, or less than 80 nanometers, or less than 70 nanometers, or less than 60 nanometers, or less than 40 nanometers, or less than 20 nanometers, or less than 10 nanometers, or even less than 5 nanometers. Such a semiconductor may be doped during growth. Such a semiconductor may be part of a device, which may include any of a variety of devices and combinations thereof, and a variety of assembling techniques may be used to fabricate devices from such a semiconductor.",[Charles M. Lieber][Yi Cui][Xiangfeng Duan][Yu Huang],[President and Fellows of Harvard College],"This application is a continuation of U.S. patent application Ser. No. 09/935,776, entitled &#x201C;Doped Elongated Semiconductors, Growing Such Semiconductors, Devices Including Such Semiconductors And Fabricating Such Devices&#x201D;, filed Aug. 22, 2001; which claims priority under 35 U.S.C. &#xA7;119(e) to commonly-owned, co-pending U.S. Provisional Patent Application Ser. No. 60/226,835, entitled, &#x201C;Semiconductor Nanowires&#x201D;, filed Aug. 22, 2000; Ser. No. 60/292,121, entitled, &#x201C;Semiconductor Nanowires&#x201D;, filed May 18, 2001; Ser. No. 60/254,745, entitled, &#x201C;Nanowire and Nanotube Nanosensors,&#x201D; filed Dec. 11, 2000; Ser. No. 60/292,035, entitled &#x201C;Nanowire and Nanotube Nanosensors,&#x201D; filed May 18, 2001; Ser. No. 60/292,045, entitled &#x201C;Nanowire Electronic Devices Including Memory and Switching Devices,&#x201D; filed May 18, 2001; and Ser. No. 60/291,896, entitled &#x201C;Nanowire Devices Including Emissive Elements and Sensors,&#x201D; filed May 18, 2001, each of which is hereby incorporated by reference in its entirety.",20061004,"This invention was sponsored by the Office of Naval Research Contract Numbers N00014-98-1-0499, N00014-99-1-0495, N00014-00-1-0476, and N00014-94-1-0302. This invention was also sponsored by the National Science Foundation Grant Number 981226. The government has certain rights in the invention.",09935776,11543336,"",""
07476851,20090113,Aerodynamic focusing of nanoparticle or cluster beams,11269932,20060102837,20060518,"Guidelines for designing lenses or systems for aerodynamic focusing of nanoparticle or cluster beams. The design process may involve obtaining a relationship between particle size, operating pressure and aperture size, and selecting the operating pressure to provide continuum flow of an aerosol beam through the aerodynamic lens. Particles having diameters less than 30 nanometer may be focused. Simulation techniques for evaluating designed lenses are also disclosed.",[Xiaoliang Wang][Peter H. McMurry][Einar Kruis],[Regents of the University of Minnesota],"This application claims priority from U.S. Provisional Application 60/627,576 filed Nov. 12, 2004 and entitled &#x201C;Aerodynamic Focusing of Nanoparticle or Cluster Beams,&#x201D; the contents of which are incorporated herein by reference.",20051109,"Funding for work described herein was provided in part by the federal government through National Science Foundation Grant No. DMI-0103169 and the Universit&#xE4;t Duisburg-Essen (Germany), which may have certain rights in the invention.","","","",""
07477802,20090113,Robust reconstruction of high resolution grayscale images from a sequence of low resolution frames,11601518,20070217713,20070920,"A computer method of creating a super-resolved grayscale image from lower-resolution images using an Lnorm data fidelity penalty term to enforce similarities between low and a high-resolution image estimates is provided. A spatial penalty term encourages sharp edges in the high-resolution image, the data fidelity penalty term is applied to space invariant point spread function, translational, affine, projective and dense motion models including fusing the lower-resolution images, to estimate a blurred higher-resolution image and then a deblurred image. The data fidelity penalty term uses the Lnorm in a likelihood fidelity term for motion estimation errors. The spatial penalty term uses bilateral-TV regularization with an image having horizontal and vertical pixel-shift terms, and a scalar weight between 0 and 1. The penalty terms create an overall cost function having steepest descent optimization applied for minimization. Direct image operator effects replace matrices for speed and efficiency.",[Peyman Milanfar][Sina Farsiu][Michael Elad][Michael D. Robinson],"[The Regents of the University of California, Santa Cruz]","",20061116,The present invention was supported in part by grant number CCR-9984246 from the National Science Foundation and grant number F49620-03-01-0387 from the U.S. Air Force. The U.S. Government has certain rights in the invention.,"","","",""
07479404,20090120,Photonic crystal biosensor structure and fabrication method,11177708,20070009968,20070111,The invention provides sensor compositions and method of making sensors.,[Brian T. Cunningham][Ian Block][Leo Li-Ying Chan],[The Board of Trustees of the University of Illinois],"",20050708,This invention was made with Government support under Grant Number BES04-27657 awarded by the National Science Foundation. The Government has certain rights in the invention.,"","","",""
07479548,20090120,Nucleic acid based ladder copolymers,10855893,"","","The present invention relates to a copolymer termed a ladder copolymer because it has two backbones that serve as legs/sides of a ladder structure. These two backbones, one of which is a nucleic acid or nucleic acid-like polymer, are linked together as the legs/sides of a ladder are linked together by the rungs.",[James Wayne Canary][Nadrian C. Seeman][Lei Zhu][Philip Lukeman],[New York University],"This application claims priority from provisional application 60/473,915, filed May 29, 2003, the entire contents which are herby incorporated by reference.",20040528,"The experiments performed in this application were supported in part by the Office of Naval Research, grant no. N00014-98-1-0093, by the National Institutes of Health, grant no. GM-29554, by the National Science Foundation, grant nos. CHE-0079702, DMI-0210844, EIA-0086015, DMR-01138790, and CTS-0103002, and by DARPA/AFSOR grant no. F30602-01-2-0561. The U.S. Government has a paid-up license in this invention and the right in limited circumstances to require the patent owner to license others on reasonable terms as provided for by the terms of the above grants.","","","",""
07479632,20090120,E-beam vision system for monitoring and control,11341154,"","","A method of characterizing an electron beam is described, comprising providing a system including an electron gun having a steering coil. A material having a surface is also provided. An electron beam from said electron gun is directed to said surface. The directing includes providing a first current to the steering coil to direct the electron beam to a first point on the surface and then providing a second current to the steering coil to direct the electron beam to a second point on the surface. An imaging system is mounted for viewing said surface. An image is collected based on light emitted from the surface because of the electron beam directed at the first point and the second point. A light intensity is determined at the first point and at the second point.",[Michael Alan Gevelber][Adam Scott Brewster][Brian Louis Vattiat],[Trustees of Boston University][Cyber Materials LLC],"This application claims priority of provisional application 60/648,776 filed Feb. 1, 2005, incorporated herein by reference.",20060127,This invention was made with Government support under contract number DMI-0339988 awarded by the National Science Foundation. The Government has certain rights in the invention.,"","","",""
07480619,20090120,Integration manager and natural interaction processor,10793183,"","",Natural interaction command decoder implemented on small embedded microprocessors. Strings of text from multiple input sources are merged to create commands. Words that are meaningful within the current system context are linked to all dependent output events while words that have no meaning within the current system context are automatically discarded.,[Neil G. Scott],[The Board of Trustees of the Leland Stanford Junior University],"The present patent application is a formalization of a previously filed, co-pending provisional patent application entitled, &#x201C;Integration Manager and Natural Interaction Processor,&#x201D; filed Mar. 4, 2003, as U.S. provisional patent application Ser. No. 60/452,262 by the inventor named in this patent application. This patent application claims the benefit of the filing date of the cited provisional patent application according to the statues and rules governing provisional patent applications, particularly, 35 USC &#xA7; 119(e)(1) and 37 CFR &#xA7;&#xA7; 1.78(a)(4) and (a)(5). The specification and drawings of the provisional patent application are specifically incorporated herein by reference. This patent application is also related to co-pending and commonly assigned patent application entitled, &#x201C;Intelligent Total Access System,&#x201D; Ser. No. 10/642,022, filed Aug. 15, 2003. This patent application claims the benefit of the filing date of provisional patent application 60/404,034, filed Aug. 16, 2002. The co-pending patent application is hereby incorporated by reference into this description as fully as if here represented in full.",20040304,This invention was made with Government support under contract 0071126 awarded by the National Science Foundation. The U.S. Government has certain rights in the invention.,"","","",""
07481866,20090127,Gas storage materials and devices,10465535,20090000474,20090101,"The invention provides a porous metal-organic framework that can be used to store gases, such as hydrogen. Also provided is metal-organic framework comprising bifunctional metallic bridging groups and organic nodes having three or more points of connection, wherein the framework has one or more cavities suitable for containing one or more storage gas molecules. The invention further provides a metal-organic framework comprising organic functional groups directed into the one or more cavities that are capable of reacting with a storage gas.",[Leonard R. MacGillivray][Giannis S. Papaefstathiou],[University of Iowa Research Foundation],"This application claims priority under 35 U.S.C. 119(e) from U.S. Provisional Application Ser. No. 60/389,828 filed Jun. 19, 2002, which application is incorporated herein by reference.",20030619,The invention described herein was made with government support under Grant Number DMR-0133138 awarded by the National Science Foundation. The United States Government has certain rights in the invention.,"","","",""
07481989,20090127,Method for cutting fullerene nanotubes,11507972,20090004094,20090101,"This invention relates generally to cutting fullerene nanotubes. In one embodiment, the present invention provides for preparation of homogeneous populations of short fullerene nanotubes by cutting and annealing (reclosing) the nanotube pieces followed by fractionation. The cutting and annealing processes may be carried out on a purified nanotube bucky paper, on felts prior to purification of nanotubes or on any material that contains fullerene nanotubes. In one embodiment, oxidative etching with concentrated nitric acid is employed to cut fullerene nanotubes into shorter lengths. The annealed nanotubes may be disbursed in an aqueous detergent solution or an organic solvent for the fractionation. Closed tubes can also be derivatized to facilitate fractionation, for example, by adding solubilizing moieties to the end caps.",[Richard E. Smalley][Daniel T. Colbert][Hongjie Dai][Jie Liu][Andrew G. Rinzler][Jason H. Hafner][Ken Smith][Ting Guo][Pavel Nikolaev][Andreas Thess],[William Marsh Rice University],"This application is a divisional of prior U.S. patent application Ser. No. 10/033,470, filed Dec. 28, 2001 now U.S. Pat. No. 7,105,596, entitled &#x201C;CARBON FIBERS FORMED FROM SINGLE-WALL CARBON NANOTUBES&#x201D;, which is a divisional of U.S. patent application Ser. No. 09/380,545, filed on Dec. 22, 1999, (issued as U.S. Pat. No. 6,683,783 on Jan. 27, 2004), which is the 35 U.S.C. &#xA7; 371 national application of International Application Number PCT/US98/04513 filed on Mar. 6, 1998, which designated the United States, claiming priority to: provisional U.S. patent application Ser. No. 60/067,325, filed on Dec. 5, 1997; provisional U.S. patent application Ser. No. 60/064,531, filed on Nov. 5, 1997; provisional U.S. patent application Ser. No. 60/063,675, filed on Oct. 29, 1997; provisional U.S. patent application Ser. No. 60/055,037, filed on Aug. 8, 1997; provisional U.S. patent application Ser. No. 60/047,854, filed on May 29, 1997; and provisional U.S. patent application Ser. No. 60/040,152, filed on Mar. 7, 1997. Each of the foregoing applications is commonly assigned to the assignee of the present invention and is hereby incorporated herein by reference in its entirety.",20060822,The present invention was made with United States Government support from the Office of Naval Research under Grant Number N00014-91-J-1794 and from the National Science Foundation under Grant Number DMR-9522251. The United States Government may have certain rights in the invention.,10033470,11507972,"",""
07482168,20090127,Photoluminescent polymetalloles as chemical sensors,10244053,20050101026,20050512,"A method to develop inexpensive inorganic polymeric sensors that can provide a sensitivity and selectivity for explosive nitroaromatic compounds. Selectivity is provided by the arrays of 12 different reactive fluorescent sensors to mimic the human olfactory system. The sensors are based on photoluminescence quenching of polymers containing metalloid-metalloid backbones such as Si—Si, Si—Ge, or Ge—Ge. The sensor employs a thin film of photoluminescent copolymers, which is stable in air, water, acids, common organic solvents, and even seawater containing bioorganisms. The detection method involves measurement of the quenching of photoluminescence of the polysilole by the analyte.",[Michael J. Sailor][William C Trogler][Honglae Sohn][Rebecca M. Calhoun],[The Regents of the University of California],"This application claims the benefit of U.S. Provisional Application Ser. No. 60/322,908, filed Sep. 15, 2001, under 35 U.S.C. &#xA7; 119.",20020914,This work is supported by the National Science Foundation (Grant CHE-0111376) and DARPA's Tactical Sensors Program via a Space and Naval Warfare Systems Center Contract (N66001-98-C-8514).,"","","",""
